{
  "topic": "Eu fui à casa da minha prima.",
  "ageRange": "1.º ano, início do ano; 6–7 anos",
  "duration": 20,
  "objectives": [
    "Localizar palavras da frase com apoio disponível.",
    "Reconstruir a frase preservando a mensagem.",
    "Identificar o destino da visita e partilhar uma leitura acompanhada."
  ],
  "curriculum": {
    "ae": [
      {
        "subject": "Português",
        "year": "1.º ano",
        "domain": "Leitura-Escrita",
        "descriptor": "Ler palavras isoladas e pequenos textos com articulação correta e prosódia adequada.",
        "source": "/home/proteu/obsidian-vault/documentos-oficiais/aprendizagens-essenciais/portugues-1-ano-1-ciclo.md"
      }
    ],
    "competencies": [
      "PA-A: Linguagens e textos",
      "PA-E: Relacionamento interpessoal"
    ],
    "scope": "Contributo inicial e acompanhado, não certificação de domínio da AE anual; fonte local DGE julho2018 revista2023."
  },
  "memAlignment": {
    "modules": [
      "Trabalho curricular comparticipado",
      "Circuitos de comunicação"
    ],
    "socialOrganization": "Professor modela, crianças em pares alternam toque e leitura, partilha oral."
  },
  "units": [
    {
      "summary": "Ler em conjunto e compreender",
      "textDescription": "Ouvir a frase Eu fui à casa da minha prima. e seguir as palavras. Selecionar onde foi a pessoa (casa/escola), sem inventar género de quem fala.",
      "duration": 5,
      "interaction": {
        "state": [
          {
            "name": "resposta",
            "type": "quiz"
          }
        ],
        "render": "Uma etapa de cada vez, controlos de toque e teclado, feedback imediato.",
        "transition": "Tocar em palavras para as destacar; selecionar destino e obter feedback.",
        "constraint": "A frase comunica uma visita à casa da prima, não à escola.",
        "assessment": "Registar seleção casa/escola; não inferir leitura oral a partir de cliques."
      },
      "differentiation": {
        "support": "Broto — Apoio: frase-modelo sempre visível; reconhecer casa e prima; reconstruir três blocos Eu fui / à casa / da minha prima.; professor lê instruções.",
        "standard": "Árvore jovem — Intermédio: frase-modelo visível; reconhecer casa, prima e fui; ordenar sete palavras por toque, com desfazer.",
        "challenge": "Árvore robusta — Desafio: modelo recolhido, botão para o consultar; reconhecer minha além das outras palavras; ordenar sete palavras e explicar oralmente uma pista."
      }
    },
    {
      "summary": "Encontrar palavras na frase",
      "textDescription": "Encontrar casa e prima; nos percursos seguintes fui e minha.",
      "duration": 5,
      "interaction": {
        "state": [
          {
            "name": "resposta",
            "type": "quiz"
          }
        ],
        "render": "Uma etapa de cada vez, controlos de toque e teclado, feedback imediato.",
        "transition": "Escolher a palavra pedida entre palavras da frase e voltar a tentar.",
        "constraint": "As palavras mantêm a sua forma e sentido em posições diferentes.",
        "assessment": "Registar tentativas e palavra selecionada."
      },
      "differentiation": {
        "support": "Broto — Apoio: frase-modelo sempre visível; reconhecer casa e prima; reconstruir três blocos Eu fui / à casa / da minha prima.; professor lê instruções.",
        "standard": "Árvore jovem — Intermédio: frase-modelo visível; reconhecer casa, prima e fui; ordenar sete palavras por toque, com desfazer.",
        "challenge": "Árvore robusta — Desafio: modelo recolhido, botão para o consultar; reconhecer minha além das outras palavras; ordenar sete palavras e explicar oralmente uma pista."
      }
    },
    {
      "summary": "Reconstruir a frase",
      "textDescription": "Ordenar blocos ou palavras tocando; ouvir/reler com colega; ponto final pertence ao último cartão.",
      "duration": 7,
      "interaction": {
        "state": [
          {
            "name": "resposta",
            "type": "sorting"
          }
        ],
        "render": "Uma etapa de cada vez, controlos de toque e teclado, feedback imediato.",
        "transition": "Cartão entra no próximo lugar; desfazer retira o último; verificar compara com a frase do professor.",
        "constraint": "A ordem dos cartões reconstrói a mensagem original.",
        "assessment": "Registar sequência e verificação, com apoio escolhido."
      },
      "differentiation": {
        "support": "Broto — Apoio: frase-modelo sempre visível; reconhecer casa e prima; reconstruir três blocos Eu fui / à casa / da minha prima.; professor lê instruções.",
        "standard": "Árvore jovem — Intermédio: frase-modelo visível; reconhecer casa, prima e fui; ordenar sete palavras por toque, com desfazer.",
        "challenge": "Árvore robusta — Desafio: modelo recolhido, botão para o consultar; reconhecer minha além das outras palavras; ordenar sete palavras e explicar oralmente uma pista."
      }
    },
    {
      "summary": "Partilhar e refletir",
      "textDescription": "Dizer a frase ao colega e desenhar em papel uma visita real ou imaginada; reflexão opcional pelos critérios.",
      "duration": 3,
      "interaction": {
        "state": [
          {
            "name": "resposta",
            "type": "quiz"
          }
        ],
        "render": "Uma etapa de cada vez, controlos de toque e teclado, feedback imediato.",
        "transition": "Pedir partilha e abrir reflexão; escolher consigo/com ajuda/quero tentar.",
        "constraint": "O registo digital e a voz do aluno são distintos da observação do professor.",
        "assessment": "Autoavaliação é declaração da criança, sem certificar desempenho oral."
      },
      "differentiation": {
        "support": "Broto — Apoio: frase-modelo sempre visível; reconhecer casa e prima; reconstruir três blocos Eu fui / à casa / da minha prima.; professor lê instruções.",
        "standard": "Árvore jovem — Intermédio: frase-modelo visível; reconhecer casa, prima e fui; ordenar sete palavras por toque, com desfazer.",
        "challenge": "Árvore robusta — Desafio: modelo recolhido, botão para o consultar; reconhecer minha além das outras palavras; ordenar sete palavras e explicar oralmente uma pista."
      }
    }
  ],
  "sessionFlow": "5+5+7+3=20 minutos flexíveis; pode interromper e retomar; sem escrita obrigatória."
}
